TranscriptID	TranscriptTime	Speaker	Segment	Text
3	0:26	1	Question	"Thank you speakers. Moving on to another question, how is the working life like in terms of working our stress level and salary? I think it's a general question that you can tackle. So so maybe we want to start with weiling."
3	0:27	4	Body	"Okay, maybe I start from big for external auditors, I guess like what Melissa mentioned, and start again, with a pretty low base. That is typically how the Big Four work previously, or the Big Four has pretty standard starting pay throughout, I guess a PWC, slightly above the rest slightly. But generally quite competitive. Long hours, a bit of differences between the Big Four by generally fairly long hours, also depends a little bit of your luck, which team you're in. But of course, that being said, if if you have about two to three years of experience in Big Four,  you experience a pretty big leap thereafter. Either if you stay or if you go, there will be a leap in salary and leap in position as well. And a lot of people go into big folder after pursue various careers including consultancy, including being a finance manager, etc. So there is one aspect of it. Currently, my life in Singapore Airlines as an internal auditor, I will say I have a pretty good work life balance. I have to get swipe at SIA. So yeah, and pay wise, I think it's okay. It doesn't really pay you exorbitantly well, like banks, but it's pretty okay. I think you survived. Definitely. Alright, back to the rest."
3	0:28	1	Body	Anyone else want to share the data?
3	0:29	2	Body	"Okay, um, for my current position, now, I am actually much more busy. I would say it's not, not really so much a factor of the industry. But more so because my organization is quite small. So there's only about 50 of us. So each of us actually have to pull quite a bit of our weight. And at certain points of time, I do feel like I could even be a one man show doing certain programs. But that's where I also enjoy it. And I learned a lot more. So that's where you saw have to compare between working in a smaller organization as well as a bigger one. But just a bit about maybe the difference between like public or private sector, I think sorting out in public service was quite good, because in terms of salary package, it's quite competitive. And for guys, they actually do consider your NS experience as well. So that's a big plus point now, but on the flip side, public service in terms of the progression and salary and all that is pretty sort of structured. So if you want to move quickly, right, then I would say the private sector will enable you to do that a lot faster. So for myself, at least, I was quite blessed because in terms of my career transitions, I was sort of headhunted along the way. So each time I've never had to actually take a pay cut when I move along law and sort of self promote myself. Yeah. So I will say currently my work life balance not so good compared to the past definitely. But I think having a good boss helps. So my boss is really very outcome focused. So she gives me the leeway to do the work as and when I want to, and it helps having a young child I can sort of plan my time. Next well,"
3	0:30	1	Body	"Melissa or Shawn, do you have any? Do you have any interesting points about your salary or your work life balance?"
3	0:31	5	Body	" I guess I can, I mean, I guess I can add on here, which is that I think, as fresh graduates it to be, I don't think you should shy away from hard work. To be honest, I'm just going to take a different approach here and just say that, I think, as a first graduate, work life balance, shouldn't be the first thing that you consider reason being, because I think every role expects the most junior person on the desk to work the hardest. So I think, across whichever industry is in whichever job or whichever company it is that you join. I just think that having a good learning attitude is something that's very important. And as a junior with perhaps not that much to contribute in terms of content knowledge, really, what you can contribute is in terms of pulling up the slack. So that will mean putting in the late hours. So I think what matters is really more for you to think about whether this is this there is something in it in the long term for you. So like, is it worth it putting the long hours now, for something that you actually want to pursue in the future? Yeah, so that's my take on it."
3	0:32	3	Body	"But I'll add on to that as well. I think you went out when I was graduating as well, I got I faced the same question. I was asking the same question as well, like, Hey, how are the working hours like, but you realize, once you step foot into work, that you can't run away from it, no matter where you go, at least for some seasons, long hours to come and find you, I can almost guarantee that. If it's no longer hours, then it's intense days, pick your poison, but there will definitely my point is there will definitely be hard times and long hours can be one of those. So let me put in a word on on how it is like for banking? The answer is it really depends. In my current role is a client facing job? Well, we do need to respond, we very responsive to the client's request and client demands and clients needs as well. If a deal is rushed in insist recommend we do put in those hours to make it happen fast. So that already is a bit of a variance a bit of dynamic, hard to predict kind of model in terms of working hours. So I will say from my experience, yes, there are days that are longer hours, there are days that I do, I don't really have to OT much at all. So it does vary. But I do like what Melissa said, which is that, try and have in mind, this is a short term, understand it is a short term pain. Think about more how you angle it for the future like you at this point in time. If you're at work, maybe you have a better idea on what this industry is about. And you're asking yourself, okay, am I willing to do this for the short term bear in the short term pain for long term benefits, because it's better for me in future? And I think that's probably the healthier mindset to go. But really don't don't don't shy away from long hours just because it does sound difficult. And of course, it's uncomfortable. You can't run away from it. Every industry out there, it will come and find you. If you don't get long hours, then you get very intense working with at least which is also not comfortable. Yeah."
3	0:33	2	Body	" Yeah, maybe just to debunk the part about public service, that there are sort of requirements to work long hours as well. In fact, my first job doing a policy work pro and Workforce Development Agency, there were days that I worked past 12 as well. So it's not always true that public service has a better work life balance. It really depends on the role, the department, the organization, the size of your team, even a boss one so far, so there are a lot of factors."
3	0:34	1	Question	"Thank you, speakers. Okay, so we have a question from the chat about accountancy and business management degrees keeping both are keeping the door open. What then should we consider we're trying to decide between the two? I think, Melissa, can that go this? Do you have like, any unique points to talk about here? Cause Yeah."
3	0:35	5	Body	"Okay, so for me, I actually did accountancy. Reason being because like I said, I didn't want to close off as many doors as possible, right? So with a business degree, you can't go into accountant. You can't be an internal auditor or you can't be an accountant. But in NTU, if you did accountancy for the first year, it's actually still possible for you to switch the degree after that to do business in the second year if you actually are interested. So I really went with it was the most practical mindset of all, which is to keep your options open as much as possible. And doing accountancy still gives you the opportunity to go into the same fields for business. Eventually if you decide during your degree At some point that you don't wish to do it, but if you start off with a business degree, you won't be able to make that transition. So that was my take on it. But I'm not sure if that's like the rest of the speakers would agree with. There's never anything to add on for this question."
3	0:36	3	Body	"I think in terms of keeping doors open, my humble opinion is that yes, accountancy does give you a few models, the business doesn't. So I'm in agreement with Melissa, I will also add on one other angle to look at it, which is that so what we just talked about is a bit more on okay, what do you do after you graduate? Right, so my next point will be so what you do when you're still studying Accountancy degree will simply have more accountancy modules, because at its core, it is an Accountancy degree. So you will have simply more, probably more numbers there, you will be studying more numbers, so to speak, whereas business, you'd have the luxury to? Well, don't take the numbers module once you're done with the initial bit. So I would add that as my two cents, Think also about what you want to do during your three, four years of study. And then also consider then what I've been saying, which is, okay, so what happens after those three, four years, then do you want a few models open? Are you are you willing to let go of those few models and go with business?"
3	0:37	1	Body	"Thanks, Melissa, Thanks, Shawn. Oh, sorry. "
3	0:38	2	Body	"Just Just a thought I put forth the observation I have about my my batch from political science, I noticed half of them actually went to public service, and the other half went to the private sector. So I would say and I had a friend personally, she did double major, both political science and business. So I think that helped her to get a role in the financial sector. So also, depending on which sector you're looking to go into, I would say, if you're looking at private sector related business degree will probably give you a better edge. Whereas if you did something like a social science degree like me, then maybe public service will sort of be a better alignment in certain sense, but doesn't mean you will be completely closed off. It's just that the way that employers view you may be slightly different. And then you have to sort of craft your your narrative. And also, depending on what you did, in school outside of studies itself, yeah."
3	0:39	1	Question	"Thank you. Thank you, everybody. So moving on to another question from the Padlet. What are some qualities that you hope to see in future leaders as people who have more senior ranking now, what do you hope to see from your juniors who are entering the workforce? Yes. Maybe we can start from Nathan."
3	0:40	2	Body	"Yep. So for me, I would say, what I will look for is really somebody who's a self starter. I'm the sort of, I guess you'll learn along the way as well, in terms of how you work with different bosses. But for me, I'm very much more outcome focused. So if there's somebody that is sort of supporting me, in my role, I really like the person to be able to figure things out themselves, in a sense, when I tell them, I'm looking at this outcome. I really sort of don't care how you get to that outcome, but we'll be able to figure it out along the way, and what's the best way to do it? So I will say, self-starter willingness to learn and a very good attitude, which is I think what Melissa and Shawn mentioned earlier, they're very important."
3	0:41	1	Body	Does anyone else have any expectations for like someone like me who will be entering the workforce soon ish?
3	0:42	5	Body	"Yeah, I actually do have an artery that I would. So I actually look out for when we look at recruiting interns or whatsoever, and it's actually resourcefulness. So I think, good learning attitude aside, that's, that's honestly one of the most important thing and most of the time when we when you join a new team, the seniors on a desk don't expect you to come with any knowledge. Because, like I say, the best thing about being young is that people give you opportunities. But I think when you are able to demonstrate resourcefulness, I think that's very critical. Because it when you are responsible, when you're resourceful, you're able to do something faster, right? Perhaps even though you're new to it, because it is able to think about new ways or faster ways of doing something. So that actually puts you in better state in terms of accomplishing more tasks. So if you think about it in an internship, you have like three months to like impress your boss, right? So if you're able to do something faster, they will just give you more things to do. So in that way you actually gain more experience. So I think if you are able to really learned that resourcefulness thing, it actually helps yourself better."
3	0:43	4	Body	"Yeah. Maybe I'll add on I feel with Madison resourcefulness, I think that is one of the traits that we look at, gather to trace and look for creative thinking, as well as being a good team player. I think particularly in today's environment, things move very fast. So I require people to think out of the box and you know, sometimes surprised me with solutions. And you know, today we're talking about things like agile, everything design thinking. These are just concepts which everybody can regurgitate. But I need somebody who can really deploy the creative thinking, and to come up with solutions that are workable, realistic. And, you know, to give a fresh perspective, I think that is very valuable to me. The second thing about teamwork is, in my aspect of work, we do work in teams. Having one strong person versus a strong team, a strong team definitely works better, putting a lot of heads together. So if you can work together as a team, I think it's going to be very tough in the workforce. And it's going to be quite disastrous in terms of networking as well. So I think teamwork definitely is another trick that I look for when I recruit staff."
3	0:44	3	Body	"And I'll just touch on one quality that I would stress. It's not about technical skills, or a particular con, what content or content knowledge or domain knowledge, it would be more of people management, or you might call it people skills, if you like, in my experience, I mean, some parts of the job, you might need your technical skills. But so far, my opinion is that people management is the hardest part of the job. Because in your role, you may be constrained by having to deal with difficult clients. But at the same time you are kind of by your boss are internal constraints. And all these people, all of these people need to manage this, right, because you need to get the job done at the end of the day. So it requires a good balance of knowing what works for you. It covers things like when you're meeting someone new, making good impressions, it covers things like when you're working day to day with your teammates, build good relationships with them. Remember, that's very, very important. departments that you don't necessarily work with. Also build very good relationships with them, because you might need them one day. And when push comes to shove, knowing what resources you can tap on knowing that, hey, this, but I should reach out to that person that team because they're really helpful. Oh, this person actually is not the most helpful type. But I really need their help. How do I get them to help me. And a lot of these are very, very tricky situations that you don't always have the luxury of time to think about. But that just stressing the point that people skills are very, very important. For me, I dare say possibly the hardest and most hardest part, the job and the most important part the job."
3	0:45	1	Question	"Okay, thank you, speakers. Um, I just got a question from the chat also from et Shah. Or just a reminder, please don't pm the any of us questions. So like, the whole zoom session can see it. But I'll just read out the question. If I get a business degree from a local uni majoring in finance, where I'm here to work in Australia, or uk If required, maybe Melissa will know bit more, because you're going to sorry, I know it's a bit of a stretch, but he's overseas."
3	0:46	5	Body	" Okay, well, that's okay, I'm not entirely sure about Australia. But I have friends that have actually relocated to Australia to work? And I would say, I would say definitely, yes, it's possible. To be honest. Once you start walking with a few years of experience under your belt, the university degree starts to matter less and less, where you get your university degree starts to matter less and less, because people are more interested to find out what it is that you have been doing during your career. So I would say if you're looking to relocate immediately post graduation, that might be slightly difficult, because I understand that you will be competing with the local pool of graduates in Australia. So if I am an employer in Australia, I don't see an added benefit in paying for your relocation from Singapore to Australia, when I can directly hire a fresh graduate in Australia with perhaps the same degree. But if you're talking about relocating post working so like, for myself, I'm relocating to Hong Kong after working in Singapore for about eight years. So I think in that case, definitely the doors are still open, you can definitely still relocate to Australia or New Zealand or or on, I would say, within Asia, it should be fairly, it should be fairly doable, because people are starting to focus less on where you got your particular degree, but what your experience is, yep."
3	0:47	1	Question	"Thank you for this. We have another question from the chat. Is it very hard to switch careers do we have to study from scratch again, I'm assuming it's within the business and accountancy industry. So if, for example you're trying to switch from, I think the speakers that got it earlier, right? Correct. Was it wedding was talking about a competency? Or was it Shawn? Yeah. Like, if you think we lived experience is kind of formed to this, right?"
3	0:48	4	Body	"Yeah. So. So I think, switching careers, you don't have to study from scratch. I'm not sure whether the other three speakers will agree with me, basically, what I have studied in accounting, maybe I only use 10% in my work. In terms of like, the soft skills, like what Shawn Melissa and later mentioned, does have people management, change management, source winners, all those, I think, are more key to be successful in every single career. Even today, I have auditors under me, who started off as engineers who started off in operations. And actually I do fairly well in internal audit, even though they do not have a degree in accounting. But the attitude again, it's very important for you to succeed. And technical skills can always be picked up on the job. It's really the soft skill set that makes the difference. So I would say you definitely wouldn't have to start from scratch."
3	0:49	2	Body	"Yeah, maybe to add a different perspective. If the question is sort of a bit broader in terms of switching careers to more sort of technical or professional careers like law, then in certain instances, you do sort of have to gap up in terms of your your study. So I have friends who, who, after political science degree, they went to do masters in law so that they can sort of be practicing lawyers. So there are instances where you might need to do some studying, depending on the career looking at. But I think, by and large, if you are looking at the space, within the industry, or even across the industry, that is sort of quite similar to what you've been working at. Seldom you will need to really do sort of additional studies, like for me, myself, I will say is a lot more about my personal development rather than a need to actually do an MBA. But I will say it gives me an edge in terms of being able to then bring it back to my work as well. So I guess that's a different angle, not so much about whether you you have to study, but whether you you does help you in your career, ultimately, as well."
3	0:50	1	Question	" Thank you. And we have another question from the chat from See, would it be worth it to pursue a business degree, so it wouldn't be worth it to proceed business degree if one only has has a strong interest, such as marketing, or HR, which seems to be only around 1/3 of the entire business curriculum? Maybe Shawn, do you think you can tackle this question? Sure."
3	0:51	3	Body	"First of all, congrats, you're probably better than most of us, you actually know what you want to do. Congrats on that it's a very, very good thing to have. My My answer would be in your case, if you already have if you already know you have a strong interest, then please pursue it. You don't have to follow us and like just keep the doors open, because you already know what you want to zero into. By all means, it's still worth it. If you ask me. I might say that the weightage of you know, marketing or HR modules is more than a third one is probably your university core modules. So the ones you have to do no matter what you're going to major in, but actually more weight on it, probably two thirds will be slightly more than that. Now, those that two thirds is your marketing or your HR modules. So I would say it is worth it. If that is your experience. "
3	0:52	1	Question	"Thank you, Shawn. Okay, we have another question. One of the speakers mentioned that data analytics is for accounting. Does it involve programming? And is it covered during the costs?"
3	0:53	4	Body	" I think there will be Cyrus. Yeah. Yeah. So just to emphasize, I think audit is moving, we are moving to what we call continuous auditing. Where data analytics is continuous and automatic. We are also moving to automatic testing as well. So these are the things going on in the industry. And involves programming to in a very basic sense. I'm not a programmer, but there are tools out there that doesn't require you to have programming skills. But definitely programming skills is very helpful. And I do understand today in accounting, there are computing courses included in the curriculum based on people I've recruited recently, and you can also pursue a minor as well in programming. So just to share I have a staff previously that was very interested in computing. So he mastered python and SQL. And it was indeed a very useful skill that you can use in auditing. You could do even basic programming for you to do certain data analysis and scripting for data extraction, which is very relevant in the audit industry today. So I think if you're keen on learning more about data and analytics, and keen in a career in accounting, I will definitely say dA is one of the things to look out for in the cloud in the Nordics, as well as external audit if I'm not wrong."
3	0:54	2	Body	"Yeah, when I was at IBM, the Institute of banking and finance, I was actually working on this report that is already published this about how data analytics and automation impacts jobs in the financial sector. I'll put the link in the chat. But it's a very long report. But basically, the point is that jobs are changing quite a bit because of data analytics automation, do take a bit of time to just read the executive summary, and you realize that a lot of roles are being much instead of disappearing because of the impact of technology. So as wailing mentioned, it is good to sort of pick up some of these skills, but also what Shawn mentioned is very true. Even as things become more automated, actually, the people skills become even more important, because these can be taken over by machines. So do take a look at the report when you have time."
3	0:55	1	Question	"Okay, we have one during the end of the session. So if we can only take one, one question before we go for closing remarks. Or maybe we can do a speed round. Okay, I see. I'll just read out vowels question first minute, what is the importance of a degree in the Speaker's respective industries? I have a polytechnic friend that is planning to stop the education pathway at the diploma stage and does not wish to further their education to get degree. Is this concerning? Actually, there's a bit of a personal age to this question, does anyone have any advice to offer to this? Person?"
3	0:56	4	Body	"Really, I'll give my two cents worth. So I think it really depends on where in the end, you want to go. Depending on organization, if I'm not wrong, the public service where you enter, really looks at your credentials, in terms of very degree, certain more traditional companies as well. But I would say that there are some people who are really very hands on. And even though they are armed with just a diploma, they go on to do very, very well, much better than people with degrees. And they tend to do a bit better, and more advanced in certain type of companies that are less traditional. And little bit of how to say, more outcome driven, and results driven rather than basing everything on your credentials. So it really depends on which company in which type of sector they're going to pursue."
3	0:57	2	Body	"It will add a bit on financials sector, I would say across the board for financial sector, they do look after a degree. But that being said, I would say there are those who join with a diploma and then they do a part time degree and then from then they move on. So that's another option as well. I always find studying, there's always a trade off. Because if you study longer than there's lesser time to join the workforce, and actually what experience in a sense, sometimes it's actually more important than then something itself. So it depends. But I would say if at least for financial sector, a degree definitely helps a lot."
